Producto,Marca,Puntaje,Calificaciones,Precio
$10 PlayStation Store Gift Card [Digital Code],PlayStation,4.7 out of 5 stars,"232,712",$10.00
PlayStation 5 Console,PlayStation,4.9 out of 5 stars,"19,822",0
Xbox Series X,Xbox,4.9 out of 5 stars,"7,979",0
$10 Xbox Gift Card [Digital Code],Microsoft,4.7 out of 5 stars,"117,508",$10.00
Xbox Series S,Microsoft,4.7 out of 5 stars,"4,134",$349.95
Xbox Game Pass Ultimate: 3 Month Membership [Digital Code],Microsoft,4.8 out of 5 stars,"15,622",$29.99
Super Mario Odyssey - Nintendo Switch,Nintendo,4.9 out of 5 stars,"23,922",$34.88
Razer Viper Mini Ultralight Gaming Mouse: Fastest Gaming Switches - 8500 DPI Optical Sensor - Chroma RGB Underglow…,0,4.7 out of 5 stars,"15,280",$29.99
$10 Nintendo eShop Gift Card [Digital Code],Nintendo,4.7 out of 5 stars,"67,688",$5.00
"Logitech G305 LIGHTSPEED Wireless Gaming Mouse, Hero 12K Sensor, 12,000 DPI, Lightweight, 6 Programmable Buttons, 250h…",0,4.7 out of 5 stars,"6,445",$49.95
Luigi's Mansion 3 - Nintendo Switch,Nintendo,4.8 out of 5 stars,"22,058",$41.99
Legend of Zelda Link's Awakening - Nintendo Switch,Nintendo,4.8 out of 5 stars,"18,629",$43.99
Ghost of Tsushima - PlayStation 4,PlayStation,4.9 out of 5 stars,"9,286",$39.88
"Logitech G502 HERO High Performance Wired Gaming Mouse, HERO 25K Sensor, 25,600 DPI, RGB, Adjustable Weights, 11…",0,4.7 out of 5 stars,"19,749",$37.99
PlayStation 5 Digital Edition,PlayStation,4.9 out of 5 stars,"5,752",0
Shin Megami Tensei V: Steelbook Launch Edition - Nintendo Switch,SEGA,-1,0,$59.99
Shin Megami Tensei V: Premium Edition - Nintendo Switch,SEGA,-1,0,0
Razer Kraken X Ultralight Gaming Headset: 7.1 Surround Sound - Lightweight Aluminum Frame - Bendable Cardioid Microphone…,0,4.4 out of 5 stars,"15,941",$39.99
Roblox Gift Card - 800 Robux [Includes Exclusive Virtual Item] [Online Game Code],Roblox,4.6 out of 5 stars,"70,115",$10.00
Razer DeathAdder Essential Gaming Mouse: 6400 DPI Optical Sensor - 5 Programmable Buttons - Mechanical Switches - Rubber…,0,4.7 out of 5 stars,"27,605",$26.44
"RUNMUS Gaming Headset Xbox One Headset with 7.1 Surround Sound Stereo, PS4 Headset with Noise Canceling Mic & LED Light…",0,4.4 out of 5 stars,"85,777",$19.99
"BENGOO G9000 Stereo Gaming Headset for PS4 PC Xbox One PS5 Controller, Noise Cancelling Over Ear Headphones with Mic…",0,4.4 out of 5 stars,"66,761",$19.99
Razer DeathAdder Essential Gaming Mouse: 6400 DPI Optical Sensor - 5 Programmable Buttons - Mechanical Switches - Rubber…,0,4.7 out of 5 stars,"27,605",$26.19
"WD_BLACK 5TB P10 Game Drive, Portable External Hard Drive HDD, Compatible with Playstation, Xbox, PC, & Mac…",0,4.8 out of 5 stars,"19,456",$129.00
Razer DeathAdder V2 Gaming Mouse: 20K DPI Optical Sensor - Fastest Gaming Mouse Switch - Chroma RGB Lighting - 8…,0,4.7 out of 5 stars,"27,605",$46.81
Razer Viper Ultimate Hyperspeed Lightest Wireless Gaming Mouse & RGB Charging Dock: Fastest Gaming Mouse Switch - 20K…,0,4.7 out of 5 stars,"15,280",$99.99
Sackboy: A Big Adventure – PlayStation 5,PlayStation,4.8 out of 5 stars,"1,728",$39.88
Mario Golf: Super Rush - Nintendo Switch,Nintendo,-1,0,$59.88
"Razer Basilisk X HyperSpeed Wireless Gaming Mouse: Bluetooth & Wireless Compatible, 16K DPI Optical Sensor, 6…",0,4.6 out of 5 stars,"16,005",$49.99
Roblox Gift Card - 2000 Robux [Includes Exclusive Virtual Item] [Online Game Code],Roblox,4.6 out of 5 stars,"70,115",$25.00
PlayStation DualSense Wireless Controller – Midnight Black,PlayStation,4.8 out of 5 stars,"25,729",$69.00
Oculus Quest 2 — Advanced All-In-One Virtual Reality Headset — 64 GB,Oculus,4.8 out of 5 stars,"49,089",$299.00
Returnal - PlayStation 5,PlayStation,4.4 out of 5 stars,571,$69.00
Danganronpa Decadence Collector's Edition - Nintendo Switch,Spike Chunsoft,-1,0,$99.99
Razer Cynosa Chroma Gaming Keyboard: Individually Backlit RGB Keys - Spill-Resistant Design - Programmable Macro…,0,4.7 out of 5 stars,"11,368",$59.99
Razer Tartarus v2 Gaming Keypad: Mecha-Membrane Key Switches - 32 Programmable Keys - Customizable Chroma RGB Lighting…,0,4.4 out of 5 stars,"7,905",$79.99
Assassin’s Creed Valhalla PlayStation 4 Standard Edition with Free Upgrade to the Digital PS5 Version,Ubisoft,4.7 out of 5 stars,"10,174",$40.00
Razer BlackShark V2 Pro Wireless Gaming Headset: THX 7.1 Spatial Surround Sound - 50mm Drivers - Detachable Mic - For PC…,0,4.5 out of 5 stars,"10,613",$141.99
Pikmin 3 Deluxe - Nintendo Switch,Nintendo,4.9 out of 5 stars,"5,721",$55.50
"Logitech G703 Lightspeed Wireless Gaming Mouse W/Hero 25K Sensor, PowerPlay Compatible, Lightsync RGB, Lightweight 95G…",0,4.7 out of 5 stars,"2,685",$59.99
Razer Kraken Tournament Edition THX 7.1 Surround Sound Gaming Headset: Retractable Noise Cancelling Mic - USB DAC - For…,0,4.5 out of 5 stars,"6,250",$46.99
PlayStation Plus: 1 Month Membership [Digital Code],PlayStation,4.7 out of 5 stars,"27,790",$9.99
Razer Kraken Ultimate RGB USB Gaming Headset: THX 7.1 Spatial Surround Sound - Chroma RGB Lighting - Retractable Active…,0,4.5 out of 5 stars,"10,800",$101.86
"NPET K10 Gaming Keyboard USB Wired Floating Keyboard, Quiet Ergonomic Water-Resistant Mechanical Feeling Keyboard, Ultra…",0,4.6 out of 5 stars,"13,894",$21.99
VALORANT $10 Gift Card - PC [Online Game Code],Riot Games,4.6 out of 5 stars,"3,752",$10.00
PlayStation DualSense Wireless Controller – Cosmic Red,PlayStation,4.8 out of 5 stars,"25,729",$74.99
"HyperX Cloud Alpha S - PC Gaming Headset, 7.1 Surround Sound, Adjustable Bass, Dual Chamber Drivers, Chat Mixer…",0,4.6 out of 5 stars,"13,284",$128.60
"Logitech G432 Wired Gaming Headset, 7.1 Surround Sound, DTS Headphone:X 2.0, Flip-to-Mute Mic, PC (Leatherette) Black…",0,4.4 out of 5 stars,"4,116",$39.99
SteelSeries Arctis 5 - RGB Illuminated Gaming Headset with DTS Headphone: X v2.0 Surround - for PC and PlayStation 4…,0,4.5 out of 5 stars,"31,039",$66.49
Super Mario 3D World + Bowser's Fury - Nintendo Switch,Nintendo,4.9 out of 5 stars,"16,193",0
